{
  "schema_version": "0.1.0",
  "tier": "mapshift_2d",
  "generator_name": "mapshift_2d_generator_v1",
  "map_size_cells": [96, 96],
  "occupancy_resolution_m": 0.25,
  "pose_mode": "continuous",
  "action_space": {
    "name": "semi_continuous_nav_v1",
    "forward_step_m": 0.25,
    "turn_angle_deg": 15.0
  },
  "observation": {
    "mode": "egocentric_local",
    "radius_m": 3.5,
    "field_of_view_deg": 100.0,
    "semantic_channels": true
  },
  "motif_families": [
    "simple_loop",
    "two_room_connector",
    "branching_chain",
    "asymmetric_multi_room_chain",
    "offset_bottleneck",
    "nested_bottleneck",
    "deceptive_shortcut",
    "disconnected_subregion",
    "spiral_loop",
    "ladder_loop",
    "double_connector_rooms",
    "zigzag_chain",
    "forked_bottleneck",
    "hub_spoke_deadends",
    "parallel_corridor",
    "ring_with_tail",
    "offset_loop_bridge",
    "split_hallway",
    "braided_shortcut",
    "narrow_gate_cluster",
    "cul_de_sac_shortcut",
    "island_bridge",
    "broken_bridge_islands",
    "asymmetric_loop_chain"
  ],
  "splits": {
    "train_motifs": [
      "simple_loop",
      "two_room_connector",
      "branching_chain",
      "spiral_loop",
      "ladder_loop",
      "double_connector_rooms",
      "zigzag_chain",
      "forked_bottleneck",
      "hub_spoke_deadends",
      "parallel_corridor"
    ],
    "val_motifs": [
      "asymmetric_multi_room_chain",
      "offset_bottleneck",
      "ring_with_tail",
      "offset_loop_bridge",
      "split_hallway",
      "braided_shortcut"
    ],
    "test_motifs": [
      "nested_bottleneck",
      "deceptive_shortcut",
      "disconnected_subregion",
      "narrow_gate_cluster",
      "cul_de_sac_shortcut",
      "island_bridge",
      "broken_bridge_islands",
      "asymmetric_loop_chain"
    ]
  },
  "exploration": {
    "canonical_budget_steps": 800,
    "reset_policy": "single_episode",
    "start_state_policy": "uniform_navigable",
    "privileged_state": false
  },
  "horizons": {
    "planning_steps": [64, 96, 128],
    "inference_steps": [16, 32],
    "adaptation_steps": [16, 32, 64]
  }
}
